route_id,new_route_id,transkribus,handnoted_comparison,corrected,note
222,228,Poste da Vienna à Madrid per Milano,Poste da Vienna a Madrid per Milano,Poste da Vienna à Madrid per Milano,
223,229,Poste da Vienna à Madrid per Inspruch,Poste da Vienna a Madrid per Inspruch,Poste da Vienna à Madrid per Inspruch,
224,230,Poste da Vienna à Paris,Poste da Vienna a Paris,Poste da Vienna à Paris,
225,231,Poste da Vienna à Madrid per Paris,Poste da Vienna a Madrid per Paris,Poste da Vienna à Madrid per Paris,
226,232,Poste da Prezlauu à Cracouia di Polonia,Poste da Prezlau a Cracovia di Polonia,Poste da Prezlaw à Cracovia di Polonia,
227,233,Poste da Preszlaw à Danfica,Poste da Prozlauu a Dansica,Poste da Preszlaw à Danfica,
228,234,Poste da Prezlaw à Naumburg,Poste da Prozlauu a Naumbure,Poste da Prezlaw à Naumburg,
229,235,Poste da Prezlau a Bosen,Poste da Prozlau a Bosen,Poste da Prezlau a Bosen,
,236,,Poste da Dansica a Naumburg,Poste da Dansica à Naumburg,
230,237,Poste da Praga à Naumburgo,Poste da Praga a Naumburgo,Poste da Praga à Naumburgo,
231,238,Poste da Praga à Dansica,Poste da Praga a Dansica,Poste da Praga à Dansica,
232,239,Poste da Dansica à Naumburg,Poste da Dansica a Naumburg,Poste da Dansica à Naumburg,Misordered
232,,Poste da Dansica à Naumburg,,,Repeated
234,240,Poste da Dansica à Glogaw,Poste da Dansica a Glogauu,Poste da Dansica à Glogaw,
235,241,Poste da Praga à Inspruch,Poste da Praga a Inspruch,Poste da Praga à Inspruch,
236,242,Poste da Praga à Madrid,Poste da Praga a Madrid,Poste da Praga à Madrid,
237,243,Poste da Praga à Lione,Poste da Praga a Lione,Poste da Praga à Lione,
238,244,Poste da Bada a Lione,Poste da Bada a Lione,Poste da Bada a Lione,
239,245,Poste d a Praga à Losana,Poste da Praga a Losana,Poste da Praga à Losana,
240,246,Poste da Praga à Bada,Poste da Praga a Bada,Poste da Praga à Bada,
241,247,Poste da Praga à Bruseles,Poste da Praga a Bruseles,Poste da Praga à Bruseles,
242,248,Poste da Bruseles à Augusta,Poste da Bruseles a Augusta,Poste da Bruseles à Augusta,
243,249,Poste da Augusta à Reijnausen,Poste da Augusta a Reijnausen,Poste da Augusta à Reijnausen,
244,250,Poste da Praga à Madrid per Paris,Poste da Praga a Madrid per Paris,Poste da Praga à Madrid per Paris,
245,251,Poste da Linz à Vienna,Poste da Linz a Vienna,Poste da Linz à Vienna,
246,252,Poste da Dansica à Steting nella Pomerania,Poste da Dansic a Steting nella Pomerania,Poste da Dansica à Steting nella Pomerania,
247,253,Poste da Salzburgo à Inspruch fuori delle Poste,Poste da Salzburgo a Inspruch fuori delle Poste,Poste da Salzburgo à Inspruch fuori delle Poste,
248,254,Poste d'Inspruch a Squartz,Poste d'Inspruch a Squartz,Poste d'Inspruch a Squartz,
249,255,Poste da Costanza à Inspruch,Poste da Costanza a Inspruch,Poste da Costanza à Inspruch,
243,256,Poste da Augusta à Reijnausen,Poste da Augusta a Reijnausen,Poste da Augusta à Reijnausen,
244,257,Poste da Praga à Madrid per Paris,Poste da Praga a Madrid per Paris,Poste da Praga à Madrid per Paris,
245,258,Poste da Linz à Vienna,Poste da Linz a Vienna,Poste da Linz à Vienna,
246,259,Poste da Dansica à Steting nella Pomerania,Poste da Dansic a Steting nella Pomerania,Poste da Dansica à Steting nella Pomerania,
247,260,Poste da Salzburgo à Inspruch fuori delle Poste,Poste da Salzburgo a Inspruch fuori delle Poste,Poste da Salzburgo à Inspruch fuori delle Poste,
248,261,Poste d'Inspruch a Squartz,Poste d'Inspruch a Squartz,Poste d'Inspruch a Squartz,
249,262,Poste da Costanza à Inspruch,Poste da Costanza a Inspruch,Poste da Costanza à Inspruch,